{
  "schemaVersion": 1,
  "report": {
    "statuses": [
      "pass",
      "fail",
      "needs-human",
      "not-applicable"
    ],
    "findingFields": [
      "checkId",
      "status",
      "severity",
      "target",
      "evidence",
      "principles",
      "antipattern",
      "suggestedFix"
    ]
  },
  "checks": [
    {
      "id": "CHK-001",
      "title": "Bordered container inside bordered container",
      "antipattern": "AP-001",
      "principles": [
        "P01",
        "P12"
      ],
      "automation": "objective",
      "kind": "dom-computed-style",
      "severity": "error",
      "description": "A visible border (any side width >= 1px with non-transparent color, or an outline) on an element whose nearest bordered ancestor within the same view also has one.",
      "procedure": [
        "Collect elements whose computed border-*-width > 0 and border-style != none and border color alpha > 0, or box-shadow with a 0-blur spread ring matching a 1px outline.",
        "For each, walk ancestors up to the app root; if an ancestor in the collection exists, report the pair.",
        "Ignore form controls listed in exceptions."
      ],
      "exceptions": [
        "input, textarea, select, checkbox and radio controls",
        "Floating overlays (menu, popover, dialog, toast) that carry a single outline",
        "Table cell grids when the table itself has no outer border"
      ],
      "thresholds": {
        "minBorderWidthPx": 1
      }
    },
    {
      "id": "CHK-002",
      "title": "Thick left border on non-quote elements",
      "antipattern": "AP-002",
      "principles": [
        "P03"
      ],
      "automation": "objective",
      "kind": "dom-computed-style",
      "severity": "error",
      "description": "border-left-width is at least 2px and is greater than the border-right-width of the same element, on an element that is not a blockquote or code diff gutter.",
      "procedure": [
        "For each element compute border-left-width and border-right-width.",
        "Report when left >= 2px and left > right and tag is not blockquote and the element does not carry data-semantic-gutter."
      ],
      "exceptions": [
        "blockquote",
        "Diff or code gutters",
        "Elements with data-semantic-gutter set by the product with a documented meaning"
      ],
      "thresholds": {
        "minLeftWidthPx": 2
      }
    },
    {
      "id": "CHK-003",
      "title": "Translucent tinted destructive button",
      "antipattern": "AP-003",
      "principles": [
        "P19",
        "P10"
      ],
      "automation": "objective",
      "kind": "dom-computed-style",
      "severity": "error",
      "description": "A button or button-like control that looks destructive (danger-colored text, or label matching a destructive verb) has a translucent background (alpha < 0.9) and danger-hued text.",
      "procedure": [
        "Select button, [role=button], a.btn.",
        "Mark destructive when text color hue is red (hue 0-20 or 340-360, saturation > 0.35) or the accessible name matches the destructive verb pattern.",
        "Fail when destructive and background-color alpha is between 0.01 and 0.9, or background is transparent with a tinted translucent sibling wrapper.",
        "Also fail when contrast of text against the composited background is below 4.5:1."
      ],
      "exceptions": [
        "Menu items (role=menuitem) styled as danger text with icon",
        "Non-interactive error banners (not buttons)"
      ],
      "thresholds": {
        "maxBackgroundAlpha": 0.9,
        "minContrast": 4.5
      },
      "patterns": [
        "^(delete|remove|discard|destroy|erase|reset|revoke|cancel subscription|resign|close position)\\b"
      ],
      "patternFlags": "i"
    },
    {
      "id": "CHK-004",
      "title": "Accent color used for focus, selection or input outline",
      "antipattern": "AP-004",
      "principles": [
        "P15",
        "P17"
      ],
      "automation": "objective",
      "kind": "source-css",
      "severity": "error",
      "description": "Focus, :focus-visible, :focus-within, [aria-selected], .selected, .active and input outline rules must not reference the brand accent color or its tints.",
      "procedure": [
        "Parse CSS rules whose selector contains :focus, :focus-visible, :focus-within, [aria-selected, [aria-current, .selected, .active.",
        "Fail if the declarations for outline, box-shadow, border-color or background reference --accent, --accent-hover, --accent-soft, --accent-text or an emerald literal (#10b981 and tints).",
        "Allow semantic danger or warn tokens."
      ],
      "exceptions": [
        "Primary action hover or pressed state (.btn-primary:hover)",
        "Brand-colored focus ring for a product that explicitly defines a brand ring in its own tokens (documented exception)"
      ],
      "patterns": [
        "--accent",
        "#10b981",
        "rgba\\(16,\\s*185,\\s*129"
      ]
    },
    {
      "id": "CHK-005",
      "title": "Decorative pill tags and status pills",
      "antipattern": "AP-005",
      "principles": [
        "P04"
      ],
      "automation": "heuristic",
      "kind": "dom-structure",
      "severity": "warning",
      "description": "Small fully rounded labels (height < 28px, border-radius >= half height) that are not interactive and that repeat on rows, or that carry words such as Saved, New, Active, Live, Beta without a filtering function.",
      "procedure": [
        "Find non-interactive elements with border-radius >= height/2, height <= 28px, text length <= 20.",
        "Count per view; raise warning when more than 3 appear or any text matches the decorative pattern.",
        "Mark needs-human when the tag appears in a filterable list (it may be functional)."
      ],
      "exceptions": [
        "Tags used to filter, group or navigate by category",
        "Count badges on navigation entries"
      ],
      "thresholds": {
        "maxPerView": 3
      },
      "patterns": [
        "^(saved|auto[- ]?saved|new|active|live|beta|pro|premium|verified|featured)$"
      ],
      "patternFlags": "i"
    },
    {
      "id": "CHK-006",
      "title": "Placeholder initials avatar",
      "antipattern": "AP-006",
      "principles": [
        "P20"
      ],
      "automation": "objective",
      "kind": "dom-structure",
      "severity": "error",
      "description": "A round element (border-radius >= 50%) whose only content is 1 to 2 letters, or an img whose src is a generated initials or identicon placeholder, with no real image.",
      "procedure": [
        "Find elements with border-radius >= 50% and width/height <= 64px.",
        "Fail when textContent trimmed matches ^[A-Za-z]{1,2}$ and there is no child img or svg with non-text content.",
        "Fail when an img src matches ui-avatars, dicebear, identicon, gravatar default or data URIs generated from initials."
      ],
      "exceptions": [
        "Real user profile images",
        "Count badges and currency symbols (not identity)"
      ],
      "patterns": [
        "^[A-Za-z]{1,2}$",
        "ui-avatars|dicebear|identicon|robohash"
      ]
    },
    {
      "id": "CHK-007",
      "title": "Excessive mobile vertical density",
      "antipattern": "AP-007",
      "principles": [
        "P18"
      ],
      "automation": "heuristic",
      "kind": "viewport-layout",
      "severity": "warning",
      "description": "At a 390px viewport, the stack above the primary content region is too tall or too tight.",
      "procedure": [
        "Render at 390x844.",
        "Measure the distance from the top of the viewport to the first primary content element (main list, feed, form).",
        "Warn when more than 3 distinct control rows precede it, when that distance exceeds 45 percent of viewport height, or when vertical gaps between adjacent control rows are below 8px.",
        "Report needs-human for borderline cases."
      ],
      "exceptions": [
        "Task screens where the controls are the content (checkout steps, forms)"
      ],
      "thresholds": {
        "viewportWidth": 390,
        "maxControlRows": 3,
        "maxTopFraction": 0.45,
        "minRowGapPx": 8
      }
    },
    {
      "id": "CHK-008",
      "title": "Send and Stop visible together",
      "antipattern": "AP-008",
      "principles": [
        "P10"
      ],
      "automation": "objective",
      "kind": "dom-structure",
      "severity": "error",
      "description": "Two controls with opposing functions for the same operation are visible at the same time.",
      "procedure": [
        "Within one container find buttons whose accessible names match Send/Submit and Stop/Cancel generation pairs.",
        "Fail when both are visible and enabled."
      ],
      "exceptions": [
        "Both actions can genuinely be used at the same time (for example Save and Discard in an editor)"
      ],
      "patterns": [
        "^(send|submit|generate)\\b",
        "^(stop|cancel|abort)\\b"
      ],
      "patternFlags": "i"
    },
    {
      "id": "CHK-009",
      "title": "Create button adjacent to a selection dropdown",
      "antipattern": "AP-009",
      "principles": [
        "P10",
        "P08"
      ],
      "automation": "heuristic",
      "kind": "dom-structure",
      "severity": "warning",
      "description": "A button whose label starts with Create, New or Add is a direct sibling of a select, combobox or dropdown trigger for the same entity type.",
      "procedure": [
        "Find select, [role=combobox], [aria-haspopup=listbox] triggers.",
        "Inspect siblings within the same row container; flag buttons matching ^(create|new|add)\\b with an entity noun in common with the dropdown label or placeholder.",
        "Report needs-human when the nouns do not match."
      ],
      "exceptions": [
        "A primary page-level Create action that is not tied to the dropdown"
      ],
      "patterns": [